{
  "dataset_class": "SYNTHETIC_INTERNAL",
  "synthetic": true,
  "disclaimer": "이 데이터는 TrustAgent 테스트와 시연을 위한 합성 승인 checklist 예시이며 실제 은행 내부자료나 실제 인간 승인 기록이 아닙니다.",
  "origin": "FIXTURE",
  "schedule_revision_id": "checklist-schedule:40343b3eaa1792400802a3e38cbb8c7d",
  "family_id": "SIN-PREPAYMENT-FEE",
  "supersedes_schedule_revision_id": null,
  "created_at": "2026-09-14T00:00:00Z",
  "entries": [
    {
      "entry_order": 0,
      "approved_checklist_version_id": "approved-checklist:2eaa5be6af97d149ee1d05a293c7e3a2",
      "effective_from": "2026-09-15",
      "effective_to": null
    }
  ]
}
